### ISSUE TITLE
[Help]: SIM7000G wrong response for CASEND

### ISSUE THREAD

**Issue by adlerre** [Xinyuan-LilyGO/LilyGo-Modem-Series#418]
### Category

Other

### Hardware

T-SIM7000G-ESP32

### PN Number

S2-108NM-Z32RG

### Firmware Version

```Shell
Revision:1529B10SIM7000G
CSUB:V02
APRev:1529B10SIM7000,V02
QCN:MDM9206_TX3.0.SIM7000G_P1.03C_20240911
```

### Description

Hello, I need help with my SIM7000G board. Sending data with the definition TINY_GSM_MODEM_SIM7000SSL is not working.

Is this a bug in TinyGSM or a firmware bug?

#### With default method modemSend in TinyGsmClientSim7000SSL.h

```cpp
  int16_t modemSend(const void* buff, size_t len, uint8_t mux) {
    // send data on prompt
    sendAT(GF("+CASEND="), mux, ',', (uint16_t)len);
    if (waitResponse(GF(">")) != 1) { return 0; }

    stream.write(reinterpret_cast<const uint8_t*>(buff), len);
    stream.flush();

    // after posting data, module responds with:
    //+CASEND: <cid>,<result>,<sendlen>
    if (waitResponse(GF(GSM_NL "+CASEND:")) != 1) { return 0; }
    streamSkipUntil(',');                            // Skip mux
    if (streamGetIntBefore(',') != 0) { return 0; }  // If result != success
    return streamGetIntBefore('\n');
  }
```

AT debug:

```
AT+CASEND=0,65

>1�␄␀<homeassistant/sensor/obd2mqtt/13e02f8d5ca2_engineLoad/config
OK
```

tcpdump on host:

```
11:25:07.902751 IP client.23301 > hostname.1883: Flags [P.], seq 172:237, ack 5, win 514, options [nop,nop,TS val 431195813 ecr 1920360576], length 65
	0x0000:  2ccf 6769 3504 3cec ef68 3be6 0800 4500  ,.gi5.<..h;...E.
	0x0010:  0075 0000 4000 4006 b6df c0a8 0102 c0a8  .u..@.@.........
	0x0020:  0151 5b05 075b c1ae 62f5 1091 368b 8018  .Q[..[..b...6...
	0x0030:  0202 840b 0000 0101 080a 19b3 86a5 7276  ..............rv
	0x0040:  6080 31c5 0400 3c68 6f6d 6561 7373 6973  `.1...<homeassis
	0x0050:  7461 6e74 2f73 656e 736f 722f 6f62 6432  tant/sensor/obd2
	0x0060:  6d71 7474 2f31 3365 3032 6638 6435 6361  mqtt/13e02f8d5ca
	0x0070:  325f 656e 6769 6e65 4c6f 6164 2f63 6f6e  2_engineLoad/con
	0x0080:  6669 67                                  fig
```

#### after patching the method

```cpp
  int16_t modemSend(const void* buff, size_t len, uint8_t mux) {
    // send data on prompt
    sendAT(GF("+CASEND="), mux, ',', (uint16_t)len);
    if (waitResponse(GF(">")) != 1) { return 0; }

    stream.write(reinterpret_cast<const uint8_t*>(buff), len);
    stream.flush();

    // OK after posting data
    if (waitResponse() != 1) { return 0; }

    return len;
  }
```

AT debug:

```
AT+CASEND=0,65

>1�␄␀<homeassistant/sensor/obd2mqtt/13e02f8d5ca2_engineLoad/config
OK
AT+CASEND=0,128

>{"~":"obd2mqtt","unique_id":"13e02f8d5ca2_engineLoad","object_id":"13e02f8d5ca2_engineLoad","name":"Engine Load","icon":"mdi:eng
OK
AT+CASEND=0,128

>ine","state_topic":"~/13e02f8d5ca2_engineLoad","unit_of_measurement":"%","state_class":"measurement","availability_topic":"~/13e
OK
AT+CASEND=0,128

>02f8d5ca2_connection","payload_available":"connected","payload_not_available":"connection lost","device":{"identifiers":["13:e0:
OK
AT+CASEND=0,128

>2f:8d:5c:a2"],"name":"13:e0:2f:8d:5c:a2","model":"OBD2 to MQTT","manufacturer":"René Adler","sw_version":"support-sim7xxx (4a10
OK
AT+CASEND=0,7

>905)"}}
OK
```

and tcpdump:

```
11:27:27.329481 IP client.41944 > hostname.1883: Flags [P.], seq 107:172, ack 5, win 514, options [nop,nop,TS val 3776779199 ecr 1920500856], length 65
	0x0000:  2ccf 6769 3504 3cec ef68 3be6 0800 4500  ,.gi5.<..h;...E.
	0x0010:  0075 0000 4000 4006 b6df c0a8 0102 c0a8  .u..@.@.........
	0x0020:  0151 a3d8 075b d3b1 35fa 8820 887a 8018  .Q...[..5....z..
	0x0030:  0202 840b 0000 0101 080a e11d 13bf 7278  ..............rx
	0x0040:  8478 31c5 0400 3c68 6f6d 6561 7373 6973  .x1...<homeassis
	0x0050:  7461 6e74 2f73 656e 736f 722f 6f62 6432  tant/sensor/obd2
	0x0060:  6d71 7474 2f31 3365 3032 6638 6435 6361  mqtt/13e02f8d5ca
	0x0070:  325f 656e 6769 6e65 4c6f 6164 2f63 6f6e  2_engineLoad/con
	0x0080:  6669 67                                  fig
11:27:27.527599 IP client.41944 > hostname.1883: Flags [P.], seq 172:300, ack 5, win 514, options [nop,nop,TS val 3776779397 ecr 1920501257], length 128
	0x0000:  2ccf 6769 3504 3cec ef68 3be6 0800 4500  ,.gi5.<..h;...E.
	0x0010:  00b4 0000 4000 4006 b6a0 c0a8 0102 c0a8  ....@.@.........
	0x0020:  0151 a3d8 075b d3b1 363b 8820 887a 8018  .Q...[..6;...z..
	0x0030:  0202 844a 0000 0101 080a e11d 1485 7278  ...J..........rx
	0x0040:  8609 7b22 7e22 3a22 6f62 6432 6d71 7474  ..{"~":"obd2mqtt
	0x0050:  222c 2275 6e69 7175 655f 6964 223a 2231  ","unique_id":"1
	0x0060:  3365 3032 6638 6435 6361 325f 656e 6769  3e02f8d5ca2_engi
	0x0070:  6e65 4c6f 6164 222c 226f 626a 6563 745f  neLoad","object_
	0x0080:  6964 223a 2231 3365 3032 6638 6435 6361  id":"13e02f8d5ca
	0x0090:  325f 656e 6769 6e65 4c6f 6164 222c 226e  2_engineLoad","n
	0x00a0:  616d 6522 3a22 456e 6769 6e65 204c 6f61  ame":"Engine.Loa
	0x00b0:  6422 2c22 6963 6f6e 223a 226d 6469 3a65  d","icon":"mdi:e
	0x00c0:  6e67                                     ng
11:27:27.749530 IP client.41944 > hostname.1883: Flags [P.], seq 300:428, ack 5, win 514, options [nop,nop,TS val 3776779619 ecr 1920501455], length 128
	0x0000:  2ccf 6769 3504 3cec ef68 3be6 0800 4500  ,.gi5.<..h;...E.
	0x0010:  00b4 0000 4000 4006 b6a0 c0a8 0102 c0a8  ....@.@.........
	0x0020:  0151 a3d8 075b d3b1 36bb 8820 887a 8018  .Q...[..6....z..
	0x0030:  0202 844a 0000 0101 080a e11d 1563 7278  ...J.........crx
	0x0040:  86cf 696e 6522 2c22 7374 6174 655f 746f  ..ine","state_to
	0x0050:  7069 6322 3a22 7e2f 3133 6530 3266 3864  pic":"~/13e02f8d
	0x0060:  3563 6132 5f65 6e67 696e 654c 6f61 6422  5ca2_engineLoad"
	0x0070:  2c22 756e 6974 5f6f 665f 6d65 6173 7572  ,"unit_of_measur
	0x0080:  656d 656e 7422 3a22 2522 2c22 7374 6174  ement":"%","stat
	0x0090:  655f 636c 6173 7322 3a22 6d65 6173 7572  e_class":"measur
	0x00a0:  656d 656e 7422 2c22 6176 6169 6c61 6269  ement","availabi
	0x00b0:  6c69 7479 5f74 6f70 6963 223a 227e 2f31  lity_topic":"~/1
	0x00c0:  3365                                     3e
11:27:27.965266 IP client.41944 > hostname.1883: Flags [P.], seq 428:556, ack 5, win 514, options [nop,nop,TS val 3776779835 ecr 1920501677], length 128
	0x0000:  2ccf 6769 3504 3cec ef68 3be6 0800 4500  ,.gi5.<..h;...E.
	0x0010:  00b4 0000 4000 4006 b6a0 c0a8 0102 c0a8  ....@.@.........
	0x0020:  0151 a3d8 075b d3b1 373b 8820 887a 8018  .Q...[..7;...z..
	0x0030:  0202 844a 0000 0101 080a e11d 163b 7278  ...J.........;rx
	0x0040:  87ad 3032 6638 6435 6361 325f 636f 6e6e  ..02f8d5ca2_conn
	0x0050:  6563 7469 6f6e 222c 2270 6179 6c6f 6164  ection","payload
	0x0060:  5f61 7661 696c 6162 6c65 223a 2263 6f6e  _available":"con
	0x0070:  6e65 6374 6564 222c 2270 6179 6c6f 6164  nected","payload
	0x0080:  5f6e 6f74 5f61 7661 696c 6162 6c65 223a  _not_available":
	0x0090:  2263 6f6e 6e65 6374 696f 6e20 6c6f 7374  "connection.lost
	0x00a0:  222c 2264 6576 6963 6522 3a7b 2269 6465  ","device":{"ide
	0x00b0:  6e74 6966 6965 7273 223a 5b22 3133 3a65  ntifiers":["13:e
	0x00c0:  303a                                     0:
11:27:28.187651 IP client.41944 > hostname.1883: Flags [P.], seq 556:684, ack 5, win 514, options [nop,nop,TS val 3776780057 ecr 1920501893], length 128
	0x0000:  2ccf 6769 3504 3cec ef68 3be6 0800 4500  ,.gi5.<..h;...E.
	0x0010:  00b4 0000 4000 4006 b6a0 c0a8 0102 c0a8  ....@.@.........
	0x0020:  0151 a3d8 075b d3b1 37bb 8820 887a 8018  .Q...[..7....z..
	0x0030:  0202 844a 0000 0101 080a e11d 1719 7278  ...J..........rx
	0x0040:  8885 3266 3a38 643a 3563 3a61 3222 5d2c  ..2f:8d:5c:a2"],
	0x0050:  226e 616d 6522 3a22 3133 3a65 303a 3266  "name":"13:e0:2f
	0x0060:  3a38 643a 3563 3a61 3222 2c22 6d6f 6465  :8d:5c:a2","mode
	0x0070:  6c22 3a22 4f42 4432 2074 6f20 4d51 5454  l":"OBD2.to.MQTT
	0x0080:  222c 226d 616e 7566 6163 7475 7265 7222  ","manufacturer"
	0x0090:  3a22 5265 6ec3 a920 4164 6c65 7222 2c22  :"Ren...Adler","
	0x00a0:  7377 5f76 6572 7369 6f6e 223a 2273 7570  sw_version":"sup
	0x00b0:  706f 7274 2d73 696d 3778 7878 2028 3461  port-sim7xxx.(4a
	0x00c0:  3130                                     10
11:27:28.408538 IP client.41944 > hostname.1883: Flags [P.], seq 684:691, ack 5, win 514, options [nop,nop,TS val 3776780278 ecr 1920502115], length 7
	0x0000:  2ccf 6769 3504 3cec ef68 3be6 0800 4500  ,.gi5.<..h;...E.
	0x0010:  003b 0000 4000 4006 b719 c0a8 0102 c0a8  .;..@.@.........
	0x0020:  0151 a3d8 075b d3b1 383b 8820 887a 8018  .Q...[..8;...z..
	0x0030:  0202 83d1 0000 0101 080a e11d 17f6 7278  ..............rx
	0x0040:  8963 3930 3529 227d 7d                   .c905)"}}
```

**Comment by lewisxhe** [comment]
I recommend using the built-in MQTT method, as it is more stable.

**Comment by lewisxhe** [comment]
TinyGsmClientSim7000SSL is derived from the original TinyGSM and has not been modified. If you encounter problems, you can try TinyGsmClientSim7000. If the problem persists, you will need to provide a modem log file. Capture the modem log file and provide the AT procedure. I will then send it to Simcom for log analysis.

**Comment by adlerre** [comment]
TinyGsmClientSim7000 works as expected because it uses CIPSEND instead of CASEND. However, I also need to support TLS/SSL, so TinyGsmClientSim7000SSL is required.

My project uses your TinyGSM fork, so it would be possible to create a pull request to address this issue. Would that be acceptable?

**Comment by lewisxhe** [comment]
If you find the problem, please submit a request.

**Comment by adlerre** [comment]
Add PR https://github.com/lewisxhe/TinyGSM-fork/pull/12

**Comment by lewisxhe** [comment]
Merged

**Comment by adlerre** [comment]
Now it's working as expected!
